{
  "id": "town",
  "about": "The town for map number 8411 and four cars, to change by hand: a ring road you can lap, an open square with the office, its deck and canopy, office blocks with alleys through them, a park and a car park. Played when data/rounds.json says map \"town\".",
  "from": { "generator": "town", "seed": 8411, "cars": 4 },
  "seed": 8411,
  "size": { "x0": -53.22, "z0": -45.94, "w": 106.43, "h": 91.87 },
  "bounds": {
    "poly": [
      [-49.22, -32.38],
      [-39.66, -41.94],
      [38.96, -41.94],
      [49.22, -31.68],
      [49.22, 33.49],
      [40.77, 41.94],
      [-49.22, 41.94]
    ],
    "wall": 2.4
  },
  "ground": [
    {
      "surface": "pave",
      "poly": [
        [-49.22, -32.38],
        [-39.66, -41.94],
        [38.96, -41.94],
        [49.22, -31.68],
        [49.22, 33.49],
        [40.77, 41.94],
        [-49.22, 41.94]
      ]
    },
    {
      "surface": "road",
      "poly": [
        [-46.72, -31.35],
        [-38.63, -39.44],
        [37.93, -39.44],
        [46.72, -30.65],
        [46.72, 32.45],
        [39.73, 39.44],
        [-46.72, 39.44]
      ]
    },
    {
      "surface": "road",
      "poly": [
        [-49.22, 12.56],
        [-46.22, 12.56],
        [-46.22, 19.56],
        [-49.22, 19.56]
      ]
    },
    {
      "surface": "road",
      "poly": [
        [-23.62, -41.94],
        [-16.62, -41.94],
        [-16.62, -38.94],
        [-23.62, -38.94]
      ]
    },
    {
      "surface": "pave",
      "poly": [
        [-35.74, -32.43],
        [-23.63, -32.43],
        [-23.63, -19.57],
        [-39.71, -19.57],
        [-39.71, -28.46]
      ],
      "kerb": true
    },
    {
      "surface": "pave",
      "poly": [
        [-16.61, -32.43],
        [35.04, -32.43],
        [39.71, -27.76],
        [39.71, -19.57],
        [-16.61, -19.57]
      ],
      "kerb": true
    },
    {
      "surface": "pave",
      "poly": [
        [-39.71, -12.55],
        [-23.63, -12.55],
        [-23.63, 12.55],
        [-39.71, 12.55]
      ],
      "kerb": true
    },
    {
      "surface": "pave",
      "poly": [
        [-16.61, -12.55],
        [39.71, -12.55],
        [39.71, 12.55],
        [-16.61, 12.55]
      ],
      "kerb": true
    },
    {
      "surface": "pave",
      "poly": [
        [-39.71, 19.57],
        [-23.63, 19.57],
        [-23.63, 32.43],
        [-39.71, 32.43]
      ],
      "kerb": true
    },
    {
      "surface": "pave",
      "poly": [
        [-16.61, 19.57],
        [16.61, 19.57],
        [16.61, 32.43],
        [-16.61, 32.43]
      ],
      "kerb": true
    },
    {
      "surface": "pave",
      "poly": [
        [23.63, 19.57],
        [39.71, 19.57],
        [39.71, 29.56],
        [36.84, 32.43],
        [23.63, 32.43]
      ],
      "kerb": true
    },
    {
      "surface": "lot",
      "poly": [
        [-14.11, -10.05],
        [37.21, -10.05],
        [37.21, 10.05],
        [-14.11, 10.05]
      ]
    },
    {
      "surface": "pave",
      "poly": [
        [14.12, -9.06],
        [26.62, -9.06],
        [26.62, 9.06],
        [14.12, 9.06]
      ]
    },
    {
      "surface": "pave",
      "poly": [
        [-37.21, 22.07],
        [-26.13, 22.07],
        [-26.13, 29.93],
        [-37.21, 29.93]
      ]
    },
    {
      "surface": "grass",
      "poly": [
        [-14.11, -29.93],
        [34, -29.93],
        [37.21, -26.72],
        [37.21, -22.07],
        [-14.11, -22.07]
      ],
      "kerb": true
    },
    {
      "surface": "pave",
      "poly": [
        [-14.11, -27.25],
        [36.68, -27.25],
        [37.21, -26.72],
        [37.21, -24.75],
        [-14.11, -24.75]
      ]
    },
    {
      "surface": "lot",
      "poly": [
        [-34.7, -29.93],
        [-26.13, -29.93],
        [-26.13, -22.07],
        [-37.21, -22.07],
        [-37.21, -27.42]
      ]
    },
    {
      "surface": "pave",
      "poly": [
        [-37.21, -10.05],
        [-26.13, -10.05],
        [-26.13, 10.05],
        [-37.21, 10.05]
      ]
    },
    {
      "surface": "pave",
      "poly": [
        [-14.11, 22.07],
        [14.11, 22.07],
        [14.11, 29.93],
        [-14.11, 29.93]
      ]
    },
    {
      "surface": "pave",
      "poly": [
        [26.13, 22.07],
        [37.21, 22.07],
        [37.21, 28.53],
        [35.81, 29.93],
        [26.13, 29.93]
      ]
    }
  ],
  "roads": [
    {
      "line": [
        [-43.22, -29.9],
        [-37.18, -35.94]
      ],
      "ring": true
    },
    {
      "line": [
        [-37.18, -35.94],
        [36.48, -35.94]
      ],
      "ring": true
    },
    {
      "line": [
        [36.48, -35.94],
        [43.22, -29.2]
      ],
      "ring": true
    },
    {
      "line": [
        [43.22, -29.2],
        [43.22, 31]
      ],
      "ring": true
    },
    {
      "line": [
        [43.22, 31],
        [38.28, 35.94]
      ],
      "ring": true
    },
    {
      "line": [
        [38.28, 35.94],
        [-43.22, 35.94]
      ],
      "ring": true
    },
    {
      "line": [
        [-43.22, 35.94],
        [-43.22, -29.9]
      ],
      "ring": true
    },
    {
      "line": [
        [-20.12, -35.94],
        [-20.12, -16.06]
      ]
    },
    {
      "line": [
        [-20.12, -16.06],
        [-20.12, 16.06]
      ]
    },
    {
      "line": [
        [-20.12, 16.06],
        [-20.12, 35.94]
      ]
    },
    {
      "line": [
        [20.12, 16.06],
        [20.12, 35.94]
      ]
    },
    {
      "line": [
        [-43.22, -16.06],
        [-20.12, -16.06]
      ]
    },
    {
      "line": [
        [-20.12, -16.06],
        [20.12, -16.06]
      ]
    },
    {
      "line": [
        [20.12, -16.06],
        [43.22, -16.06]
      ]
    },
    {
      "line": [
        [-43.22, 16.06],
        [-20.12, 16.06]
      ]
    },
    {
      "line": [
        [-20.12, 16.06],
        [20.12, 16.06]
      ]
    },
    {
      "line": [
        [20.12, 16.06],
        [43.22, 16.06]
      ]
    }
  ],
  "junctions": [
    [-43.22, -16.06],
    [-43.22, 16.06],
    [-20.12, -35.94],
    [-20.12, -16.06],
    [-20.12, 16.06],
    [-20.12, 35.94],
    [20.12, -16.06],
    [20.12, 16.06],
    [20.12, 35.94],
    [43.22, -16.06],
    [43.22, 16.06]
  ],
  "markings": [
    {
      "type": "hatch",
      "poly": [
        [24.02, -1.47],
        [24.02, 10.53],
        [20.02, 10.53],
        [20.02, -1.47]
      ]
    },
    {
      "type": "zebra",
      "line": [
        [19.82, 4.53],
        [13.12, 4.53]
      ],
      "depth": 3.4
    },
    { "type": "giveWay", "x": -43.22, "z": -16.06, "yaw": -1.5708 },
    { "type": "giveWay", "x": -43.22, "z": 16.06, "yaw": -1.5708 },
    { "type": "giveWay", "x": -20.12, "z": -35.94, "yaw": 3.1416 },
    { "type": "giveWay", "x": -20.12, "z": 35.94, "yaw": 0 },
    { "type": "giveWay", "x": 20.12, "z": 35.94, "yaw": 0 },
    { "type": "giveWay", "x": 43.22, "z": -16.06, "yaw": 1.5708 },
    { "type": "giveWay", "x": 43.22, "z": 16.06, "yaw": 1.5708 }
  ],
  "pieces": [
    { "piece": "building-white", "x": 31.67, "z": 0, "yaw": 0, "w": 10.1, "l": 18.13, "h": 10.2 },
    { "piece": "building-white", "x": -31.67, "z": 26, "yaw": 0, "w": 9.52, "l": 6.29, "h": 6.8 },
    { "piece": "pavilion", "x": 11.55, "z": -26, "yaw": 1.5708 },
    { "piece": "building-white", "x": -31.67, "z": 0, "yaw": 0, "w": 9.23, "l": 18.26, "h": 6.8 },
    { "piece": "building-white", "x": 0, "z": 26, "yaw": 0, "w": 25.16, "l": 4.8, "h": 10.2 },
    { "piece": "building-white", "x": 31.17, "z": 26, "yaw": 0, "w": 8.35, "l": 6.13, "h": 10.2 },
    {
      "piece": "building-white",
      "x": -49.11,
      "z": -41.83,
      "yaw": 2.3562,
      "w": 13.21,
      "l": 13.51,
      "h": 10.2,
      "outer": true
    },
    {
      "piece": "building-white",
      "x": -33.89,
      "z": -48.06,
      "yaw": 1.5708,
      "w": 12.25,
      "l": 11.54,
      "h": 6.8,
      "outer": true
    },
    {
      "piece": "building-white",
      "x": 0.7,
      "z": -48.12,
      "yaw": 1.5708,
      "w": 12.38,
      "l": 24.62,
      "h": 10.2,
      "outer": true
    },
    {
      "piece": "building-white",
      "x": 24.65,
      "z": -47.74,
      "yaw": 1.5708,
      "w": 11.61,
      "l": 23.28,
      "h": 6.8,
      "outer": true
    },
    {
      "piece": "building-brick",
      "x": 47.86,
      "z": -40.58,
      "yaw": 0.7854,
      "w": 10.66,
      "l": 14.5,
      "h": 13.6,
      "outer": true
    },
    {
      "piece": "building-white",
      "x": 54.96,
      "z": -18.82,
      "yaw": 0,
      "w": 11.5,
      "l": 25.73,
      "h": 10.2,
      "outer": true
    },
    {
      "piece": "building-white",
      "x": 55.46,
      "z": 0.73,
      "yaw": 0,
      "w": 12.49,
      "l": 13.36,
      "h": 10.2,
      "outer": true
    },
    {
      "piece": "building-white",
      "x": 54.3,
      "z": 22.04,
      "yaw": 0,
      "w": 10.16,
      "l": 22.89,
      "h": 10.2,
      "outer": true
    },
    {
      "piece": "building-brick",
      "x": 48.85,
      "z": 41.57,
      "yaw": -0.7854,
      "w": 10.91,
      "l": 11.95,
      "h": 17,
      "outer": true
    },
    {
      "piece": "building-white",
      "x": 33.79,
      "z": 48.83,
      "yaw": -1.5708,
      "w": 13.8,
      "l": 13.96,
      "h": 6.8,
      "outer": true
    },
    {
      "piece": "building-brick",
      "x": 13.02,
      "z": 48.33,
      "yaw": -1.5708,
      "w": 12.8,
      "l": 20.4,
      "h": 13.6,
      "outer": true
    },
    {
      "piece": "building-white",
      "x": -9.19,
      "z": 47.12,
      "yaw": -1.5708,
      "w": 10.36,
      "l": 24.01,
      "h": 10.2,
      "outer": true
    },
    {
      "piece": "building-white",
      "x": -31.28,
      "z": 47.8,
      "yaw": -1.5708,
      "w": 11.73,
      "l": 20.15,
      "h": 10.2,
      "outer": true
    },
    {
      "piece": "building-white",
      "x": -54.86,
      "z": 33,
      "yaw": 3.1416,
      "w": 11.29,
      "l": 17.87,
      "h": 10.2,
      "outer": true